display_order,strategy_id,role,family,mode,execution_profile,what_changes_vs_baseline,time_windows,slope_lookback,slope_threshold,require_vwap_slope_alignment,max_vwap_distance_atr,atr_buffer,stop_buffer,max_trades_per_day,max_losses_per_day,daily_stop_threshold_usd,consecutive_losses_threshold,exit_on_vwap_recross,notes
1,paper_vwap_baseline,paper_baseline_reference,baseline,target_position,paper_reference,"Reference officielle: close[t-1] vs VWAP[t-1], next open, always-in-market RTH, flat overnight.",full_rth,5,0.0,False,,0.25,0.25,,,,,True,"Exact paper logic: previous close relative to session VWAP drives the next bar position, always in market during RTH, flat overnight."
2,baseline_futures_adapted,realistic_baseline_reference,baseline,target_position,repo_realistic,"Meme signal que la baseline paper, mais sous sizing futures fixe et couts repo_realistic.",full_rth,5,0.0,False,,0.25,0.25,,,,,True,"Same signal logic as the paper baseline, but priced with realistic futures costs."
3,vwap_time_filtered_baseline,candidate,prop_variant,target_position,repo_realistic,Baseline paper gatee par une fenetre horaire simple pour n'autoriser que certaines entrees et flips.,09:35:00->11:30:00|15:00:00->15:50:00,5,0.0,False,,0.25,0.25,,,,,True,Paper signal with allowed entries and reversals only in the profitable time buckets.
4,vwap_baseline_trade_capped,candidate,prop_variant,target_position,repo_realistic,Baseline paper avec plafond dur sur le nombre de flips/trades par jour.,full_rth,5,0.0,False,,0.25,0.25,6.0,,,,True,Paper signal with a hard cap on the number of daily flips/trades.
5,vwap_baseline_regime_filtered,candidate,prop_variant,target_position,repo_realistic,Baseline paper gatee par un filtre de pente VWAP et un filtre simple de distance au VWAP.,full_rth,5,0.0,True,1.0,0.25,0.25,8.0,,,,True,Paper signal gated by previous-bar VWAP slope alignment and a simple distance-to-VWAP filter.
6,vwap_baseline_with_killswitch,candidate,prop_variant,target_position,repo_realistic,"Baseline paper avec kill switches journaliers simples: pertes max, stop daily, plafond de trades.",full_rth,5,0.0,False,,0.25,0.25,12.0,3.0,750.0,,True,Paper signal with daily loss and trade-count controls.
7,vwap_reclaim,candidate,prop_variant,discrete,repo_realistic,"Variante discrete reclaim simple avec pente VWAP, buffer ATR et sortie sur recross/stop/session close.",full_rth,5,0.0,False,,0.25,0.25,3.0,,,,True,"VWAP reclaim after compression, confirmed by positive or negative VWAP slope."
8,vwap_reclaim_with_prop_overlay,candidate,prop_variant,discrete,repo_realistic,"Variante reclaim simple avec overlay prop: fenetres horaires, cap de trades, daily stop et deleveraging.",09:35:00->11:30:00|15:00:00->15:50:00,5,0.0,False,,0.25,0.25,2.0,2.0,500.0,2.0,True,"Reclaim variant with time filter, hard daily stop, trade cap, and position deleveraging after a losing streak."
